"Indicators","0 to 200 m","200 to 800 m","more than 800 m"
"Average intensity (I-1)",0.99,1.61,0.03
"Proportion of area in fished cells (I-2)",0.81,0.73,0.12
"Proportion of area fished per year (I-3)",0.43,0.49,0.02
"Smallest  prop. of area in fished cells with 90% of fishing effort (I-4)",0.34,0.33,0.02
"Proportion of area in unfished cells (I-5)",0.19,0.27,0.88
"Average PD impact (I-6)",NA,NA,NA
"Average L1 impact (I-6)",NA,NA,NA
"Proportion of area with PD impact < 0.2 (I-7)",NA,NA,NA
"Proportion of area with L1 impact < 0.2 (I-7)",NA,NA,NA
